{
  "$schema": "./UNI_REMEDIATION_QUEUE_G7_B_SCHEMA.json",
  "schema_version": "G7-B-remediation-queue",
  "queue_id": "G7-B-provenance-remediation",
  "metadata_only": true,
  "observed_at": "2026-10-18",
  "source_audit": {
    "audit_id": "G6-B-provenance",
    "report": "docs/coordination/UNI_PROVENANCE_AUDIT_G6.json",
    "record_count": 33
  },
  "scope": {
    "included_categories": [
      "missing_manifest_id",
      "missing_metadata_only",
      "license_missing",
      "g3_pdf_blocked",
      "gse_context_only",
      "alias_not_deduplicated"
    ],
    "excluded_residual_codes": [
      "external_url_availability_not_checked",
      "independent_license_clearance_not_checked",
      "current_version_or_vigency_not_checked",
      "content_or_legal_accuracy_not_checked"
    ],
    "policy": "Only G6-observed gaps are queued; no gap is closed by this report."
  },
  "summary": {
    "item_count": 48,
    "open_item_count": 48,
    "by_status": {
      "open": 48
    },
    "by_category": {
      "missing_manifest_id": 14,
      "missing_metadata_only": 14,
      "license_missing": 4,
      "g3_pdf_blocked": 1,
      "gse_context_only": 1,
      "alias_not_deduplicated": 14
    }
  },
  "items": [
    {
      "item_id": "G7-B-MANIFEST-ID-20fb331aae60",
      "category": "missing_manifest_id",
      "status": "open",
      "evidence_ref": null,
      "source_ref": "docs/coordination/UNI_CORPUS_LOTTO_G1.json#G1-001",
      "source_audit": {
        "audit_id": "G6-B-provenance",
        "audit_report": "docs/coordination/UNI_PROVENANCE_AUDIT_G6.json"
      },
      "closure_evidence": [],
      "closure_criteria": [
        "The source manifest explicitly declares a stable manifest_id.",
        "The chosen identifier is reviewed by the corpus owner; it is not inferred by this queue.",
        "A regenerated G6 audit no longer reports the residual code for the affected records."
      ],
      "constraints": [
        "Do not modify source files or source payloads.",
        "Do not infer missing provenance, license, URL, or legal status.",
        "Do not promote a proof state from metadata alone."
      ],
      "record": {
        "record_key": "docs/coordination/UNI_CORPUS_LOTTO_G1.json#G1-001",
        "manifest_path": "docs/coordination/UNI_CORPUS_LOTTO_G1.json",
        "manifest_id": "G1-FONDAMENTI-GUTENBERG-RAW",
        "record_id": "G1-001",
        "record_kind": "source",
        "local_path": "Fondamenti_Pack/raw/gutenberg/Aristotle_Ethics_pg8438.txt",
        "proof_state": "observed_local"
      },
      "observed_gap": {
        "g6_residual_code": "manifest_id_not_declared_lot_id_used_as_reference",
        "field": "manifest_id",
        "g6_manifest_id_source": "lot_id_fallback",
        "g6_effective_reference": "G1-FONDAMENTI-GUTENBERG-RAW"
      }
    },
    {
      "item_id": "G7-B-MANIFEST-ID-d8ace45a8272",
      "category": "missing_manifest_id",
      "status": "open",
      "evidence_ref": null,
      "source_ref": "docs/coordination/UNI_CORPUS_LOTTO_G1.json#G1-002",
      "source_audit": {
        "audit_id": "G6-B-provenance",
        "audit_report": "docs/coordination/UNI_PROVENANCE_AUDIT_G6.json"
      },
      "closure_evidence": [],
      "closure_criteria": [
        "The source manifest explicitly declares a stable manifest_id.",
        "The chosen identifier is reviewed by the corpus owner; it is not inferred by this queue.",
        "A regenerated G6 audit no longer reports the residual code for the affected records."
      ],
      "constraints": [
        "Do not modify source files or source payloads.",
        "Do not infer missing provenance, license, URL, or legal status.",
        "Do not promote a proof state from metadata alone."
      ],
      "record": {
        "record_key": "docs/coordination/UNI_CORPUS_LOTTO_G1.json#G1-002",
        "manifest_path": "docs/coordination/UNI_CORPUS_LOTTO_G1.json",
        "manifest_id": "G1-FONDAMENTI-GUTENBERG-RAW",
        "record_id": "G1-002",
        "record_kind": "source",
        "local_path": "Fondamenti_Pack/raw/gutenberg/Calculus_Made_Easy_Thompson.txt",
        "proof_state": "observed_local"
      },
      "observed_gap": {
        "g6_residual_code": "manifest_id_not_declared_lot_id_used_as_reference",
        "field": "manifest_id",
        "g6_manifest_id_source": "lot_id_fallback",
        "g6_effective_reference": "G1-FONDAMENTI-GUTENBERG-RAW"
      }
    },
    {
      "item_id": "G7-B-MANIFEST-ID-3100c5a811ae",
      "category": "missing_manifest_id",
      "status": "open",
      "evidence_ref": null,
      "source_ref": "docs/coordination/UNI_CORPUS_LOTTO_G1.json#G1-003",
      "source_audit": {
        "audit_id": "G6-B-provenance",
        "audit_report": "docs/coordination/UNI_PROVENANCE_AUDIT_G6.json"
      },
      "closure_evidence": [],
      "closure_criteria": [
        "The source manifest explicitly declares a stable manifest_id.",
        "The chosen identifier is reviewed by the corpus owner; it is not inferred by this queue.",
        "A regenerated G6 audit no longer reports the residual code for the affected records."
      ],
      "constraints": [
        "Do not modify source files or source payloads.",
        "Do not infer missing provenance, license, URL, or legal status.",
        "Do not promote a proof state from metadata alone."
      ],
      "record": {
        "record_key": "docs/coordination/UNI_CORPUS_LOTTO_G1.json#G1-003",
        "manifest_path": "docs/coordination/UNI_CORPUS_LOTTO_G1.json",
        "manifest_id": "G1-FONDAMENTI-GUTENBERG-RAW",
        "record_id": "G1-003",
        "record_kind": "source",
        "local_path": "Fondamenti_Pack/raw/gutenberg/Descartes_Discourse_pg59.txt",
        "proof_state": "observed_local"
      },
      "observed_gap": {
        "g6_residual_code": "manifest_id_not_declared_lot_id_used_as_reference",
        "field": "manifest_id",
        "g6_manifest_id_source": "lot_id_fallback",
        "g6_effective_reference": "G1-FONDAMENTI-GUTENBERG-RAW"
      }
    },
    {
      "item_id": "G7-B-MANIFEST-ID-216f877f179e",
      "category": "missing_manifest_id",
      "status": "open",
      "evidence_ref": null,
      "source_ref": "docs/coordination/UNI_CORPUS_LOTTO_G1.json#G1-004",
      "source_audit": {
        "audit_id": "G6-B-provenance",
        "audit_report": "docs/coordination/UNI_PROVENANCE_AUDIT_G6.json"
      },
      "closure_evidence": [],
      "closure_criteria": [
        "The source manifest explicitly declares a stable manifest_id.",
        "The chosen identifier is reviewed by the corpus owner; it is not inferred by this queue.",
        "A regenerated G6 audit no longer reports the residual code for the affected records."
      ],
      "constraints": [
        "Do not modify source files or source payloads.",
        "Do not infer missing provenance, license, URL, or legal status.",
        "Do not promote a proof state from metadata alone."
      ],
      "record": {
        "record_key": "docs/coordination/UNI_CORPUS_LOTTO_G1.json#G1-004",
        "manifest_path": "docs/coordination/UNI_CORPUS_LOTTO_G1.json",
        "manifest_id": "G1-FONDAMENTI-GUTENBERG-RAW",
        "record_id": "G1-004",
        "record_kind": "source",
        "local_path": "Fondamenti_Pack/raw/gutenberg/Einstein_Relativity_pg30155.txt",
        "proof_state": "observed_local"
      },
      "observed_gap": {
        "g6_residual_code": "manifest_id_not_declared_lot_id_used_as_reference",
        "field": "manifest_id",
        "g6_manifest_id_source": "lot_id_fallback",
        "g6_effective_reference": "G1-FONDAMENTI-GUTENBERG-RAW"
      }
    },
    {
      "item_id": "G7-B-MANIFEST-ID-2779fa8bfa39",
      "category": "missing_manifest_id",
      "status": "open",
      "evidence_ref": null,
      "source_ref": "docs/coordination/UNI_CORPUS_LOTTO_G1.json#G1-005",
      "source_audit": {
        "audit_id": "G6-B-provenance",
        "audit_report": "docs/coordination/UNI_PROVENANCE_AUDIT_G6.json"
      },
      "closure_evidence": [],
      "closure_criteria": [
        "The source manifest explicitly declares a stable manifest_id.",
        "The chosen identifier is reviewed by the corpus owner; it is not inferred by this queue.",
        "A regenerated G6 audit no longer reports the residual code for the affected records."
      ],
      "constraints": [
        "Do not modify source files or source payloads.",
        "Do not infer missing provenance, license, URL, or legal status.",
        "Do not promote a proof state from metadata alone."
      ],
      "record": {
        "record_key": "docs/coordination/UNI_CORPUS_LOTTO_G1.json#G1-005",
        "manifest_path": "docs/coordination/UNI_CORPUS_LOTTO_G1.json",
        "manifest_id": "G1-FONDAMENTI-GUTENBERG-RAW",
        "record_id": "G1-005",
        "record_kind": "source",
        "local_path": "Fondamenti_Pack/raw/gutenberg/Euclid_Elements.txt",
        "proof_state": "observed_local"
      },
      "observed_gap": {
        "g6_residual_code": "manifest_id_not_declared_lot_id_used_as_reference",
        "field": "manifest_id",
        "g6_manifest_id_source": "lot_id_fallback",
        "g6_effective_reference": "G1-FONDAMENTI-GUTENBERG-RAW"
      }
    },
    {
      "item_id": "G7-B-MANIFEST-ID-9ec7563b0a3d",
      "category": "missing_manifest_id",
      "status": "open",
      "evidence_ref": null,
      "source_ref": "docs/coordination/UNI_CORPUS_LOTTO_G1.json#G1-006",
      "source_audit": {
        "audit_id": "G6-B-provenance",
        "audit_report": "docs/coordination/UNI_PROVENANCE_AUDIT_G6.json"
      },
      "closure_evidence": [],
      "closure_criteria": [
        "The source manifest explicitly declares a stable manifest_id.",
        "The chosen identifier is reviewed by the corpus owner; it is not inferred by this queue.",
        "A regenerated G6 audit no longer reports the residual code for the affected records."
      ],
      "constraints": [